2019-06-28 22:51:41,Donald J. Trump,1144740178948493314,"After some very important meetings, including my meeting with President Xi of China, I will be leaving Japan for South Korea (with President Moon). While there, if Chairman Kim of North Korea sees this, I would meet him at the Border/DMZ just to shake his hand and say Hello(?)!"
2019-06-28 22:41:17,Donald J. Trump,1144737559786020864,"54% in Poll! I would be at 75% (with our great economy, maybe the best ever) if not for the Phony Witch Hunt and the Fake News Media!"
2019-06-28 09:26:34,Donald J. Trump,1144537564944228352,"I am in Japan at the G-20, representing our Country well, but I heard it was not a good day for Sleepy Joe or Crazy Bernie. One is exhausted, the other is nuts - so what’s the big deal?"
2019-06-28 09:12:18,Donald J. Trump,1144533973428842496,"The Stock Market went up massively from the day after I won the Election, all the way up to the day that I took office, because of the enthusiasm for the fact that I was going to be President. That big Stock Market increase must be credited to me. If Hillary won - a Big Crash!"
2019-06-28 01:37:04,Donald J. Trump,1144419410729242625,All Democrats just raised their hands for giving millions of illegal aliens unlimited healthcare. How about taking care of American Citizens first!? That’s the end of that race!
2019-06-28 00:46:37,Donald J. Trump,1144406713165963264,"Great to be back in Japan for the #G20OsakaSummit
https://t.co/ZUwla1UMAQ"
2019-06-27 22:22:39,Donald J. Trump,1144370485783867392,Bipartisan Humanitarian Aid Bill for the Southern Border just passed. A great job done by all! Now we must work to get rid of the Loopholes and fix Asylum. Thank you also to Mexico for the work being done on helping with Illegal Immigration - a very big difference!
2019-06-27 17:37:32,Donald J. Trump,1144298734311878657,".....United States Supreme Court is given additional information from which it can make a final and decisive decision on this very critical matter. Can anyone really believe that as a great Country, we are not able the ask whether or not someone is a Citizen. Only in America!"
2019-06-27 17:37:32,Donald J. Trump,1144298731887628288,"Seems totally ridiculous that our government, and indeed Country, cannot ask a basic question of Citizenship in a very expensive, detailed and important Census, in this case for 2020. I have asked the lawyers if they can delay the Census, no matter how long, until the....."
2019-06-27 13:28:46,Donald J. Trump,1144236129769742336,Thank you! #G20Summit https://t.co/28Y5rPE3BE
2019-06-27 09:36:39,Donald J. Trump,1144177713869017089,"Thank you @MSNBC, real professionals! @chucktodd @maddow https://t.co/7ZCkcUQ4yA"
2019-06-27 03:47:05,Donald J. Trump,1144089743795216384,"I look forward to speaking with Prime Minister Modi about the fact that India, for years having put very high Tariffs against the United States, just recently increased the Tariffs even further. This is unacceptable and the Tariffs must be withdrawn!"
2019-06-27 02:40:04,Donald J. Trump,1144072877290872832,https://t.co/JDS4zVfyBe
2019-06-27 02:33:50,Donald J. Trump,1144071307941703680,Just stopped in Alaska and said hello to our GREAT troops! https://t.co/oLYn1mpaVm
2019-06-27 02:06:51,Donald J. Trump,1144064520152739840,".@NBCNews and @MSNBC should be ashamed of themselves for having such a horrible technical breakdown in the middle of the debate. Truly unprofessional and only worthy of a FAKE NEWS Organization, which they are!"
2019-06-27 01:35:55,Donald J. Trump,1144056731653169152,BORING!
2019-06-27 00:02:08,Donald J. Trump,1144033134129758208,These flyers depict Australia’s policy on Illegal Immigration. Much can be learned! https://t.co/QgGU0gyjRS
2019-06-26 23:52:03,Donald J. Trump,1144030595422420993,".@ByronYork: “What now, for those who denied a 'crisis' at the border?” https://t.co/g0EO7Xs0yE"
2019-06-26 23:46:05,Donald J. Trump,1144029093358235648,"....They came to me asking for help, and I got Criminal Justice Reform passed, with help from both Republicans and Democrats. Many said that nobody but President Trump could have done this. All previous administrations failed. Please ask why THEY failed to the candidates!"
2019-06-26 23:46:04,Donald J. Trump,1144029089465958401,"Ever since the passage of the Super Predator Crime Bill, pushed hard by @JoeBiden, together with Bill and Crooked Hillary Clinton, which inflicted great pain on many, but especially the African American Community, Democrats have tried and failed to pass Criminal Justice Reform..."
2019-06-26 23:14:52,Donald J. Trump,1144021236764164096,"For tonight’s #DemDebate, be sure to follow @TeamTrump, @TrumpWarRoom, @Parscale, @KayleighMcEnany, @TimMurtaugh, and @Marc_Lotter for RAPID RESPONSE, FACT CHECKING, and the TRUTH! #MAGA #KAG Sorry, I’m on Air Force One, off to save the Free World!"
2019-06-26 22:47:43,Donald J. Trump,1144014405715161088,"....and all of the others who have leaked, lied and did so many other terrible things? How is it even possible that these people are not being brought forward? Because it is a Rigged Democrat Con Game, and the Fake and Corrupt Media loves every minute of it!"
2019-06-26 22:47:42,Donald J. Trump,1144014401164337152,"Why aren’t the Democrats in the House calling Comey, Brennan, Clapper, Page and her FBI lover (whose invaluable phone records were illegally deleted), Crooked Hillary, Podesta, Ohr (and Nellie), the GPS Fusion characters, Christopher Steele, the DNC (&amp; their missing server)...."
2019-06-26 21:47:40,Donald J. Trump,1143999292538937344,"The Republican Senate just passed bipartisan humanitarian assistance for our Southern Border, 84-8! In addition to aid, Congress must close the catastrophic loopholes that are driving the Crisis. We must end incentives for Smuggling Children, Trafficking Women, and Selling Drugs."
2019-06-26 21:46:46,Donald J. Trump,1143999067300610048,"....No Collusion, No Obstruction! Robert Mueller said he was done after his last 9 minute news conference, as later corrected. Now the Dems want to  give it another try. Does it ever end?"
2019-06-26 21:46:45,Donald J. Trump,1143999063613853696,"According to Fake News (and low ratings) @CNN, “Democrats say hearings could change impeachment debate.” That’s because they have lost the impeachment debate (80% say NO), and they are hoping that yet another DO OVER, after 2 1/2 years and $40,000,000, will turn things around...."
2019-06-26 21:17:54,Donald J. Trump,1143991802405376000,"“I have been in office for many years, the Military is very important to me, and at no time in my professional life has the U.S. Military been as strong as it is right now.” Thank you @LindseyGrahamSC"
2019-06-26 20:31:31,Donald J. Trump,1143980127161708544,https://t.co/mudnBtvWO1
2019-06-26 20:24:00,Donald J. Trump,1143978235878789120,The Democrats would save many lives if they would change our broken and very DANGEROUS Immigration Laws. It can be done instantly!
2019-06-26 19:13:22,Donald J. Trump,1143960463442530304,"Just departed for the #G20 Summit in Osaka, Japan!🇺🇸🇯🇵 https://t.co/IdAYUOiWqf"
2019-06-26 18:26:41,Donald J. Trump,1143948712684576768,"The Democrats should change the Loopholes and Asylum Laws so lives will be saved at our Southern Border. They said it was not a crisis at the Border, that it was all just “manufactured.” Now they admit that I was right - But they must do something about it. Fix the Laws NOW!"
2019-06-26 16:53:37,Donald J. Trump,1143925292492365824,"It was my great honor to speak at the Faith &amp; Freedom Coalition Conference today in Washington, D.C. Thank you! #RTM2019 https://t.co/KknwcFhawb"
2019-06-26 14:42:38,Donald J. Trump,1143892329582997505,"....invited Megan or the team, but I am now inviting the TEAM, win or lose. Megan should never disrespect our Country, the White House, or our Flag, especially since so much has been done for her &amp; the team. Be proud of the Flag that you wear. The USA is doing GREAT!"
2019-06-26 14:42:38,Donald J. Trump,1143892328236687361,"....in our Country’s history, and the poverty index is also best number EVER), leagues and teams love coming to the White House. I am a big fan of the American Team, and Women’s Soccer, but Megan should WIN first before she TALKS! Finish the job! We haven’t yet...."
2019-06-26 14:42:37,Donald J. Trump,1143892326286266368,"Women’s soccer player, @mPinoe, just stated that she is “not going to the F...ing White House if we win.” Other than the NBA, which now refuses to call owners, owners (please explain that I just got Criminal Justice Reform passed, Black unemployment is at the lowest level..."
2019-06-26 11:13:58,Donald J. Trump,1143839815600918528,"Democrats want Open Borders, which equals violent crime, drugs and human trafficking. They also want very high taxes, like 90%. Republicans want what’s good for America - the exact opposite!"
2019-06-26 11:05:24,Donald J. Trump,1143837659783225346,I will be interviewed by @MariaBartiromo today at 8:15 A.M. on @FoxBusiness. Enjoy!
2019-06-26 11:01:04,Donald J. Trump,1143836568513392641,"Too bad the Dems in Congress won’t do anything at all about Border Security. They want Open Borders, which means crime. But we are getting it done, including building the Wall! More people than ever before are coming because the USA Economy is so good, the best in history."
2019-06-26 10:52:31,Donald J. Trump,1143834417246461953,"RT @ABC: Jared Kushner speaks at U.S. Mideast peace plan conference in Bahrain: ""For a moment, imagine a new reality in the Middle East."" h…"
2019-06-26 10:51:27,Donald J. Trump,1143834150455132162,RT @FLOTUS: Looking forward to collaborating with all of our #BeBest Ambassadors. Delighted to be working alongside so many people both ins…
2019-06-26 10:50:16,Donald J. Trump,1143833851820724224,RT @realDonaldTrump: Stock Market is heading for one of the best months (June) in the history of our Country. Thank you Mr. President!
2019-06-26 10:50:05,Donald J. Trump,1143833804810981376,"RT @SecretaryAcosta: Headed to Texas today to discuss #apprenticeship expansion, #PledgetoAmericasWorkers, and the #USMCA. Texas has added…"
2019-06-26 10:48:51,Donald J. Trump,1143833496282193921,RT @dougducey: Proud to stand with 27 other governors in calling for Congress to ratify #USMCA. It updates our nation’s trade agreements wi…
2019-06-26 10:47:59,Donald J. Trump,1143833277016498176,"RT @Jim_Jordan: Tomorrow’s hearing on the “Hatch Act” is just the latest attempt to silence the Trump administration.

@KellyannePolls is a…"
2019-06-26 10:47:32,Donald J. Trump,1143833165968150530,RT @mike_pence: What Americans hear tomorrow night will only confirm that Mexico has done more in the last 10 DAYS to secure the southern b…
2019-06-26 10:46:22,Donald J. Trump,1143832871771234304,"RT @ericbolling: Great choice @realDonaldTrump choosing @StephGrisham45 as your @PressSec !!

https://t.co/jpv8z421TQ"
2019-06-26 10:45:29,Donald J. Trump,1143832650131615744,"RT @IvankaTrump: Great keynoting the Senate’s weekly policy lunch and discussing workforce development policy, Higher Ed Act reauthorizatio…"
2019-06-26 10:45:10,Donald J. Trump,1143832567851995137,"RT @EricTrump: I hope everyone reads and watches this video to see the corruption of big tech. ⁦@Google⁩ should be absolutely ashamed.

Un…"
2019-06-26 10:44:43,Donald J. Trump,1143832456379981825,"RT @mike_pence: America needs 4 more years of prosperity, 4 more years of security, and 4 MORE YEARS of President @realDonaldTrump! #KeepAm…"
2019-06-26 10:44:29,Donald J. Trump,1143832395969454080,"RT @PressSec: .@StephGrisham45 will be an incredible asset to the President and the country. I’m sad to leave the WH, but so happy our team…"
2019-06-26 10:43:13,Donald J. Trump,1143832077810446336,"RT @realDonaldTrump: Staff Sgt. David Bellavia - today, we honor your extraordinary courage, we salute your selfless service, and we thank…"
2019-06-26 10:41:22,Donald J. Trump,1143831611466821633,"RT @mike_pence: Latino Americans know that it was freedom, not socialism, that gave us the most prosperous and powerful nation in the histo…"
2019-06-26 10:41:00,Donald J. Trump,1143831520894996480,RT @MariaBartiromo: Tomorrow exclusive join us as ⁦@POTUS⁩ ⁦@realDonaldTrump⁩ joins me #LIVE ⁦@MorningsMaria⁩ ⁦⁦@FoxBusiness⁩ 8am et https:…
2019-06-26 10:40:12,Donald J. Trump,1143831318951866368,"Wow, @FoxNews did great in the ratings. CNN is dead as a door nail
(no credibility), and MSNBC is dying fast. @foxandfriends and @MariaBartiromo are doing great! https://t.co/0sFBVmjR7f"
2019-06-26 10:23:32,Donald J. Trump,1143827125084020742,RT @JudicialWatch: A Judicial Watch lawsuit forced the state of California to begin removing more than 1.5 million potentially invalid name…
2019-06-26 10:23:08,Donald J. Trump,1143827024911446016,"RT @JudicialWatch: Hillary Clinton is not above the law, yet she has a record of contempt for the rule of law. Our leaders are bound by the…"
2019-06-26 10:22:31,Donald J. Trump,1143826870753988609,RT @JudicialWatch: .@TomFitton: “CA settled with JW &amp; is taking steps to remove 1.5M inactive voters from the rolls. It’s important for ele…
2019-06-26 02:34:41,Donald J. Trump,1143709133234954241,Presidential Harassment!
2019-06-25 22:20:42,Donald J. Trump,1143645216907378695,"Senator Thom Tillis of North Carolina has really stepped up to the plate. Thom is tough on Crime, Strong on the Border and fights hard against Illegal Immigration. He loves our Military, our Vets and our great Second Amendment. I give Thom my Full and Total Endorsement!"
2019-06-25 21:38:42,Donald J. Trump,1143634648729378816,"Staff Sgt. David Bellavia - today, we honor your extraordinary courage, we salute your selfless service, and we thank you for carrying on the legacy of American Valor that has always made our blessed nation the strongest and mightiest in the world! https://t.co/pQ3dhhaSpE"
2019-06-25 20:27:19,Donald J. Trump,1143616683271233537,"Today, it was my great honor to present the Medal of Honor to Army Staff Sgt. David Bellavia (HERO) for his courageous actions as a squad leader in Fallujah. #MOH https://t.co/FkNCazkWWo"
2019-06-25 19:25:20,Donald J. Trump,1143601087238172672,"....Martha is strong on Crime and Borders, the 2nd Amendment, and loves our Military and Vets. She has my Complete and Total Endorsement!"
2019-06-25 19:25:20,Donald J. Trump,1143601086080659462,"A brave former fighter jet pilot and warrior, Senator Martha McSally of Arizona has done an outstanding job in D.C., and is fully supportive of our agenda – she is with us all the way...."
2019-06-25 14:42:30,Donald J. Trump,1143529907403788288,"....Iran’s very ignorant and insulting statement, put out today, only shows that they do not understand reality. Any attack by Iran on anything American will be met with great and overwhelming force. In some areas, overwhelming will mean obliteration. No more John Kerry &amp; Obama!"
2019-06-25 14:42:29,Donald J. Trump,1143529905323479041,"....The wonderful Iranian people are suffering, and for no reason at all. Their leadership spends all of its money on Terror, and little on anything else. The U.S. has not forgotten Iran’s use of IED’s &amp; EFP’s (bombs), which killed 2000 Americans, and wounded many more..."
2019-06-25 14:42:29,Donald J. Trump,1143529903238893568,"Iran leadership doesn’t understand the words “nice” or “compassion,” they never have. Sadly, the thing they do understand is Strength and Power, and the USA is by far the most powerful Military Force in the world, with 1.5 Trillion Dollars invested over the last two years alone.."
2019-06-25 12:11:59,Donald J. Trump,1143492027897778176,Stock Market is heading for one of the best months (June) in the history of our Country. Thank you Mr. President!
2019-06-25 12:01:30,Donald J. Trump,1143489389210812416,RT @SteveScalise: Thank you @IvankaTrump for joining me and our Republican Whip Team at the Capitol tonight to talk about the work you’re d…
2019-06-25 11:59:20,Donald J. Trump,1143488845859753985,RT @SharylAttkisson: Who thinks the debates just won't be the same without Donna Brazile working on them behind the scenes?
2019-06-25 11:59:09,Donald J. Trump,1143488800741400576,RT @mike_pence: Looking forward to being in Miami today to kick off the @TeamTrump Latino Coalition! Under @realDonaldTrump more Hispanic A…
2019-06-25 11:58:45,Donald J. Trump,1143488699579162624,"RT @VP: Mexico is keeping its promise &amp; now sending 15,000 troops to border to help with crisis. Meanwhile Dems won’t fund beds for migrant…"
2019-06-24 14:12:31,Donald J. Trump,1143159975277187072,I am pleased to announce the launch of https://t.co/D1MY2aPC7f. This new platform will allow my campaign and other Republicans to compete with the Democrats money machine. This has been a priority of mine and I’m pleased to share that it is up and running! #KeepAmericaGreat
2019-06-24 12:53:34,Donald J. Trump,1143140106557186048,"....Think of what it could have been if the Fed had gotten it right. Thousands of points higher on the Dow, and GDP in the 4’s or even 5’s. Now they stick, like a stubborn child, when we need rates cuts, &amp; easing, to make up for what other countries are doing against us. Blew it!"
2019-06-24 12:53:34,Donald J. Trump,1143140105076563970,"Despite a Federal Reserve that doesn’t know what it is doing - raised rates far too fast (very low inflation, other parts of world slowing, lowering &amp; easing) &amp; did large scale tightening, $50 Billion/month, we are on course to have one of the best Months of June in US history..."
2019-06-24 12:08:02,Donald J. Trump,1143128646162493441,....a dangerous journey. We don’t even need to be there in that the U.S. has just become (by far) the largest producer of Energy anywhere in the world! The U.S. request for Iran is very simple - No Nuclear Weapons and No Further Sponsoring of Terror!
2019-06-24 12:08:01,Donald J. Trump,1143128642878410752,"China gets 91% of its Oil from the Straight, Japan 62%, &amp; many other countries likewise. So why are we protecting the shipping lanes for other countries (many years) for zero compensation. All of these countries should be protecting their own ships on what has always been...."
2019-06-24 11:13:24,Donald J. Trump,1143114897640873984,RT @realDonaldTrump: https://t.co/SSWnX8oQ65
2019-06-24 11:13:16,Donald J. Trump,1143114863864156165,RT @realDonaldTrump: https://t.co/gw9cXRTtaR
2019-06-24 11:07:36,Donald J. Trump,1143113438085963778,RT @realDonaldTrump: https://t.co/GY34Y0OeAS
2019-06-24 11:06:30,Donald J. Trump,1143113161375191040,"RT @HolcombForIN: Governor Holcomb is working hard alongside @IvankaTrump, Commerce @SecretaryRoss &amp; America's top CEOs to scale Indiana's…"
2019-06-24 11:06:10,Donald J. Trump,1143113078084702209,RT @IvankaTrump: “The Trump administration served as a catalyst for perhaps the largest criminal justice public-private-partnership ever as…
2019-06-24 11:03:06,Donald J. Trump,1143112307335213056,RT @VP: Mexico has done more to secure our border in 10 days than Democrats in Congress have in 10 YEARS. The time to put Americans first i…
2019-06-24 00:50:08,Donald J. Trump,1142958047247130625,https://t.co/GY34Y0OeAS
2019-06-24 00:41:13,Donald J. Trump,1142955802950606848,https://t.co/gw9cXRTtaR
2019-06-23 14:46:46,Donald J. Trump,1142806204898582528,"When our Country had no debt and built everything from Highways to the Military with CASH, we had a big system of Tariffs. Now we allow other countries to steal our wealth, treasure, and jobs - But no more! The USA is doing great, with unlimited upside into the future!"
2019-06-23 13:20:39,Donald J. Trump,1142784534204882944,Wonderful Church service at Camp David. Thank you!
2019-06-23 12:13:26,Donald J. Trump,1142767618086133761,"I want to give the Democrats every last chance to quickly negotiate simple changes to Asylum and Loopholes. This will fix the Southern Border, together with the help that Mexico is now giving us. Probably won’t happen, but worth a try. Two weeks and big Deportation begins!"
2019-06-22 22:58:10,Donald J. Trump,1142567481124503552,"I never called the strike against Iran “BACK,” as people are incorrectly reporting, I just stopped it from going forward at this time!"
2019-06-22 21:24:47,Donald J. Trump,1142543983656218624,https://t.co/SSWnX8oQ65
2019-06-22 18:56:35,Donald J. Trump,1142506687020130306,"At the request of Democrats, I have delayed the Illegal Immigration Removal Process (Deportation) for two weeks to see if the Democrats and Republicans can get together and work out a solution to the Asylum and Loophole problems at the Southern Border. If not, Deportations start!"
2019-06-22 18:56:34,Donald J. Trump,1142506683660455936,"....Sanctions come off Iran, and they become a productive and prosperous nation again - The sooner the better!"
2019-06-22 18:56:33,Donald J. Trump,1142506680300789761,"Iran cannot have Nuclear Weapons! Under the terrible Obama plan, they would have been on their way to Nuclear in a short number of years, and existing verification is not acceptable. We are putting major additional Sanctions on Iran on Monday. I look forward to the day that....."
2019-06-22 16:55:49,Donald J. Trump,1142476293331738624,"I am at Camp David working on many things, including Iran! We have a great Economy, Tariffs have been very helpful both with respect to the huge Dollars coming IN, &amp; on helping to make good Trade Deals. The Dow heading to BEST June in 80 years! Stock Market BEST June in 50 years!"
2019-06-22 16:48:26,Donald J. Trump,1142474437264105472,https://t.co/mUc2KZFZON
2019-06-22 16:47:20,Donald J. Trump,1142474158678466560,Thank you Jessica! https://t.co/gxNRfFqZCm
2019-06-22 15:59:33,Donald J. Trump,1142462134925877248,A great book! https://t.co/QwB46HVpmv
2019-06-22 15:58:50,Donald J. Trump,1142461955900420096,RT @EricTrump: The crowds and the spirit outside the Amway Center waiting for @realDonaldTrump is absolutely incredible! #Orlando #2020 #Ma…
2019-06-22 15:58:37,Donald J. Trump,1142461901445718016,"RT @EricTrump: This isn’t a campaign, this is a movement! Thank you Orlando - we love you! #Florida #KeepAmericaGreat 🇺🇸🇺🇸🇺🇸 https://t.co/M…"
2019-06-22 15:58:15,Donald J. Trump,1142461806935445504,Looking good. We MUST WIN to KEEP AMERICA GREAT! https://t.co/ADULIQ0tO1
2019-06-22 15:56:52,Donald J. Trump,1142461457495470082,RT @EricTrump: Behind the scenes in #Orlando - what an amazing night! ⁦@DonaldJTrumpJr⁩ ⁦@IvankaTrump⁩ https://t.co/DRqicdEFFY
2019-06-22 14:13:16,Donald J. Trump,1142435387496902656,Stock Market is on track to have the best June in over 50 years! Thank you Mr. President! @WSJ
2019-06-22 12:32:25,Donald J. Trump,1142410006513500161,"When people come into our Country illegally, they will be DEPORTED!"
2019-06-22 12:30:27,Donald J. Trump,1142409512240013313,"The people that Ice will apprehend have already been ordered to be deported. This means that they have run from the law and run from the courts. These are people that are supposed to go back to their home country. They broke the law by coming into the country, &amp; now by staying."
2019-06-22 02:52:20,Donald J. Trump,1142264023825735681,"RT @Jim_Jordan: There is a crisis at our border. Time for Congress to wake up, secure the border, and #DoWhatWeSaid. https://t.co/GCCJ9sYDkR"
2019-06-22 02:51:59,Donald J. Trump,1142263935904747520,"RT @RepMarkMeadows: The irony of Washington Democrats all but ignoring the dire situation at the border: they're calling it a ""manufactured…"
2019-06-22 02:49:45,Donald J. Trump,1142263375327584258,"RT @GOP: Under @realDonaldTrump’s leadership, Florida is THRIVING!

Read more from Pam Bondi— former AG of Florida⬇️
https://t.co/pLNpaO4…"
2019-06-21 19:50:23,Donald J. Trump,1142157838153895941,https://t.co/JDS4zUXXJG
2019-06-21 13:03:18,Donald J. Trump,1142055392488374272,"....proportionate to shooting down an unmanned drone. I am in no hurry, our Military is rebuilt, new,  and ready to go, by far the best in the world. Sanctions are biting &amp; more added last night. Iran can NEVER have Nuclear Weapons, not against the USA, and not against the WORLD!"
2019-06-21 13:03:17,Donald J. Trump,1142055388965212161,"....On Monday they shot down an unmanned drone flying in International Waters. We were cocked &amp; loaded to retaliate last night on 3 different sights when I asked, how many will die. 150 people, sir, was the answer from a General. 10 minutes before the strike I stopped it, not...."
2019-06-21 13:03:16,Donald J. Trump,1142055383193804801,"....Death to America. I terminated deal, which was not even ratified by Congress, and imposed strong sanctions. They are a much weakened nation today than at the beginning of my Presidency, when they were causing major problems throughout the Middle East. Now they are Bust!...."
2019-06-21 13:03:14,Donald J. Trump,1142055375186907136,"President Obama made a desperate and terrible deal with Iran - Gave them 150 Billion Dollars plus I.8 Billion Dollars in CASH! Iran was in big trouble and he bailed them out. Gave them a free path to Nuclear Weapons, and SOON. Instead of saying thank you, Iran yelled....."
2019-06-21 12:19:50,Donald J. Trump,1142044452258766849,"....”This Russia Collusion Hoax was perpetrated in part by people inside the government, and in part by a compliant (Fake News) media.” Mollie Hemingway.  @TuckerCarlson @foxandfriends  The facts are starting to pour out. Stay tuned!"
2019-06-21 12:19:49,Donald J. Trump,1142044450413301760,"Just revealed that the Failing and Desperate New York Times was feeding false stories about me, &amp; those associated with me, to the FBI. This shows the kind of unprecedented hatred I have been putting up with for years with this Crooked newspaper. Is what they have done legal?..."
