2019-06-20 22:22:36,Donald J. Trump,1141833755033767943,S&amp;P closes at Record High! https://t.co/C5nOXIQ7EJ
2019-06-20 17:49:52,Donald J. Trump,1141765119929700353,It was my great honor to host Canadian Prime Minister @JustinTrudeau at the @WhiteHouse today!🇺🇸🇨🇦 https://t.co/orlejZ9FFs
2019-06-20 14:15:04,Donald J. Trump,1141711064305983488,Iran made a very big mistake!
2019-06-20 14:14:13,Donald J. Trump,1141710851617034240,“The President has a really good story to tell. We have unemployment lower than we’ve seen in decades. We have people who stopped looking for work coming back into the labor force. We are in a record growth period.” Michael Steel @MSNBC (do you believe?)
2019-06-20 13:58:53,Donald J. Trump,1141706991464849408,S&amp;P opens at Record High!
2019-06-20 00:12:31,Donald J. Trump,1141499029727121408,"Since Election Day 2016, Stocks up almost 50%, Stocks gained 9.2 Trillion Dollars in value, and more than 5,000,000 new jobs added to the Economy. @LouDobbs If our opponent had won, there would have been a market crash, plain and simple! @TuckerCarlson @seanhannity @IngrahamAngle"
2019-06-19 23:01:59,Donald J. Trump,1141481280653209600,Congratulations to President Lopez Obrador — Mexico voted to ratify the USMCA today by a huge margin. Time for Congress to do the same here!
2019-06-19 20:39:28,Donald J. Trump,1141445414824136704,"Just returning from Orlando and Doral (Miami), Florida, and heading to the Oval Office, where I will present the great Economist, Dr. Arthur Laffer, with the Presidential Medal of Freedom."
2019-06-19 20:29:24,Donald J. Trump,1141442879518322689,I will be interviewed LIVE tonight by @seanhannity on @FoxNews  9 P.M. Enjoy!
2019-06-19 19:48:04,Donald J. Trump,1141432478491717632,"....asking Hillary Clinton why she deleted and acid washed her Emails AFTER getting a subpoena from Congress? Anybody else would be in jail for that, yet the Dems refuse to even bring it up. Rigged House Committee"
2019-06-19 19:48:02,Donald J. Trump,1141432472602927108,"So sad that the Democrats are putting wonderful Hope Hicks through hell, for 3 years now, after total exoneration by Robert Mueller &amp; the Mueller Report. They were unhappy with result so they want a Do Over. Very unfair &amp; costly to her. Will it ever end? Why aren’t they......."
2019-06-19 15:09:18,Donald J. Trump,1141362325619916801,"If I didn’t have the Phony Witch Hunt going on for 3 years, and if the Fake News Media and their partner in Crime, the Democrats, would have played it straight, I would be way up in the Polls right now - with our Economy, winning by 20 points. But I’m winning anyway!"
2019-06-19 14:20:04,Donald J. Trump,1141349936044417024,DEMOCRAT CONGRESSIONAL HEARINGS ARE #RIGGED!
2019-06-19 14:18:12,Donald J. Trump,1141349463904141320,"....33,000 Emails that Hillary and her lawyer deleted and acid washed AFTER GETTING A SUBPOENA FROM CONGRESS? That is real Obstruction that the Dems want no part of because their hearings are RIGGED and a disgrace to our Country!"
2019-06-19 14:18:11,Donald J. Trump,1141349462478135296,"The Dems are very unhappy with the Mueller Report, so after almost 3 years, they want a Redo, or Do Over. This is extreme Presidential Harassment. They gave Crooked Hillary’s people complete Immunity, yet now they bring back Hope Hicks. Why aren’t the Dems looking at the....."
2019-06-19 12:54:55,Donald J. Trump,1141328504929300480,THANK YOU! #Trump2020🇺🇸 https://t.co/recnmmYAFN
2019-06-19 02:13:11,Donald J. Trump,1141167008739971072,"Don’t ever forget - this election is about YOU. It is about YOUR family, YOUR future, &amp; the fate of YOUR COUNTRY. We begin our campaign with the best record, the best results, the best agenda, &amp; the only positive VISION for our Country’s future! #Trump2020 https://t.co/Vmu28hKQh6"
2019-06-19 02:04:07,Donald J. Trump,1141164726593998850,"In the ultimate act of moral cowardice, not one Democrat Candidate for president - not a single one - has stood up to defend the incredible men and women of ICE and Border Patrol. They don’t have the character, the virtue, or the spine! #Trump2020 https://t.co/oULNnVtxmW"
2019-06-19 01:58:51,Donald J. Trump,1141163403186245632,On no issue are Democrats more extreme – and more depraved – than when it comes to Border Security. The Democrat Agenda of open borders is morally reprehensible. It is the great betrayal of the American Middle Class and our Country as a whole! #Trump2020 https://t.co/f9RJhpp50J
2019-06-19 01:52:19,Donald J. Trump,1141161757819441152,"Together, we are breaking the most sacred rule in Washington Politics: we are KEEPING our promises to the American People. Because my only special interest is YOU! #Trump2020 https://t.co/bYyK6sOrak"
2019-06-19 01:48:36,Donald J. Trump,1141160822988771328,"THANK YOU ORLANDO, FLORIDA!https://t.co/Va9FhByJi0"
2019-06-18 23:54:28,Donald J. Trump,1141132100273418240,"Join me LIVE tonight in Orlando, Florida at 8:00 P.M. Eastern as we kickoff #Trump2020. Enjoy!"
2019-06-18 20:32:07,Donald J. Trump,1141081177392128002,"Departing for Orlando, Florida with @FLOTUS Melania! https://t.co/EB2ewYArUP"
2019-06-18 16:59:12,Donald J. Trump,1141027595380826118,"....I thank Pat for his outstanding service and will be naming Secretary of the Army, Mark Esper, to be the new Acting Secretary of Defense. I know Mark, and have no doubt he will do a fantastic job!"
2019-06-18 16:59:12,Donald J. Trump,1141027593774346240,"Acting Secretary of Defense Patrick Shanahan, who has done a wonderful job, has decided not to go forward with his confirmation process so that he can devote more time to his family...."
2019-06-18 14:22:52,Donald J. Trump,1140988251584569350,German DAX way up due to stimulus remarks from Mario Draghi. Very unfair to the United States!
2019-06-18 14:09:23,Donald J. Trump,1140984860628213760,“ECB officials see Rate Cut as primary tool for any new stimulus.”  @business
2019-06-18 13:39:38,Donald J. Trump,1140977371421564928,Had a very good telephone conversation with President Xi of China. We will be having an extended meeting next week at the G-20 in Japan. Our respective teams will begin talks prior to our meeting.
2019-06-18 11:30:23,Donald J. Trump,1140944847039324160,"The Fake News doesn’t report it, but Republican enthusiasm is at an all time   high. Look what is going on in Orlando, Florida, right now! People have never seen anything like it (unless you play a guitar). Going to be wild - See you later!"
2019-06-18 11:21:34,Donald J. Trump,1140942625475837954,European Markets rose on comments (unfair to U.S.) made today by Mario D!
2019-06-18 10:53:44,Donald J. Trump,1140935620291964928,"Mario Draghi just announced more stimulus could come, which immediately dropped the Euro against the Dollar, making it unfairly easier for them to compete against the USA. They have been getting away with this for years, along with China and others."
2019-06-18 05:10:06,Donald J. Trump,1140849141796474880,"Only a few people showed up for the so-called Impeachment rallies over the weekend. The numbers were anemic, no spirit, no hope. More importantly, No Collusion, No Obstruction!"
2019-06-18 04:51:18,Donald J. Trump,1140844412127326208,Wow!  The State Department said it has identified 30 Security Incidents involving current or former employees and their handling of Crooked Hillary Clinton’s Emails. @FoxNews  This is really big. Never admitted before. Highly Classified Material. Will the Dems investigate this?
2019-06-18 02:13:41,Donald J. Trump,1140804748423118848,"The story in the @nytimes about the U.S. escalating attacks on Russia’s power grid is Fake News, and the Failing New York Times knows it. They should immediately release their sources which, if they exist at all, which I doubt, are phony. Times must be held fully accountable!"
2019-06-18 01:39:40,Donald J. Trump,1140796187248922625,"Thousands of people are already lined up in Orlando, some two days before tomorrow nights big Rally. Large Screens and food trucks will be there for those that can’t get into the 25,000 capacity arena. It will be a very exciting evening! Make America Great Again!"
2019-06-18 01:20:39,Donald J. Trump,1140791402323959809,"....long before they get to our Southern Border. Guatemala is getting ready to sign a Safe-Third Agreement. The only ones who won’t do anything are the Democrats in Congress. They must vote to get rid of the loopholes, and fix asylum! If so, Border Crisis will end quickly!"
2019-06-18 01:20:39,Donald J. Trump,1140791400658870274,"Next week ICE will begin the process of removing the millions of illegal aliens who have illicitly found their way into the United States. They will be removed as fast as they come in. Mexico, using their strong immigration laws, is doing a very good job of stopping people......."
2019-06-17 23:49:43,Donald J. Trump,1140768516288782336,".@FoxNews Polls are always bad for me. They were against Crooked Hillary also. Something weird going on at Fox. Our polls show us leading in all 17 Swing States. For the record, I didn’t spend 30 hours with @abcnews, but rather a tiny fraction of that. More Fake News  @BretBaier"
2019-06-17 19:05:30,Donald J. Trump,1140696990843572225,"One size doesn’t fit all - I support West Virginia Schools. Keep up the great work, @WVGovernor Big Jim Justice -  I am with you! https://t.co/EomFLcBjlz"
2019-06-17 15:49:44,Donald J. Trump,1140647726209781760,“Iran to defy Uranium Stockpile Limits”
2019-06-17 12:07:00,Donald J. Trump,1140591670280564737,"Only Fake Polls show us behind the Motley Crew. We are looking really good, but it is far too early to be focused on that. Much work to do! MAKE AMERICA GREAT AGAIN!"
2019-06-17 12:00:45,Donald J. Trump,1140590099870171137,"Big Rally tomorrow night in Orlando, Florida, looks to be setting records. We are building large movie screens outside to take care of everybody. Over 100,000 requests. Our Country is doing great, far beyond what the haters &amp; losers thought possible - and it will only get better!"
2019-06-17 02:18:01,Donald J. Trump,1140443450321657866,"Thank you Mr. Prime Minister, a great honor! https://t.co/ozLz84g3i0"
2019-06-17 01:59:07,Donald J. Trump,1140438692605190144,"RT @i24NEWS_EN: Earlier today, @netanyahu and @USAmbIsrael held a ceremony for the inauguration of 'Trump Heights' — a town in #Israel's Go…"
2019-06-17 01:51:16,Donald J. Trump,1140436717511593984,RT @LindseyGrahamSC: Very glad to see Mexico working with President @realDonaldTrump to up their game and deal with immigration from Centra…
2019-06-17 01:48:26,Donald J. Trump,1140436006472245248,"Congratulations to Gary Woodland in winning the United States Open Golf Championship. Fantastic playing, great heart - there will be more in Gary’s future!"
2019-06-16 22:55:55,Donald J. Trump,1140392587720830976,"Rep. Alexandria Ocasio-Cortez. “I think we have a very real risk of losing the Presidency to Donald Trump.” I agree, and that is the only reason they play the impeach card, which cannot be legally used!"
2019-06-16 21:23:31,Donald J. Trump,1140369337947185161,Almost 70% in new Poll say don’t impeach. So ridiculous to even be talking about this subject when all of the crimes were committed by the other side. They can’t win the election fairly!
2019-06-16 21:08:10,Donald J. Trump,1140365475127463936,RT @DanScavino: “Millennial fighting rare bone cancer responds to @JoeBiden vow: Law supported by @realDonaldTrump helped save my life” htt…
2019-06-16 20:36:12,Donald J. Trump,1140357430095810560,"......If Republicans ever did that to the Democrats, there would be all hell to pay. It would be a scandal like no other!"
2019-06-16 20:36:10,Donald J. Trump,1140357421547839488,"When will the Fake News Media start asking Democrats if they are OK with the hiring of Christopher Steele, a foreign agent, paid for by Crooked Hillary and the DNC, to dig up “dirt” and write a phony Dossier against the Presidential Candidate of the opposing party........."
2019-06-16 19:00:49,Donald J. Trump,1140333422767824896,Thank you PM @Netanyahu and the State of Israel for this great honor!🇺🇸🇮🇱 https://t.co/OUcf6s98UX
2019-06-16 16:58:13,Donald J. Trump,1140302570394738688,https://t.co/9T50NuGW28
2019-06-16 13:55:08,Donald J. Trump,1140256498561536000,"Happy Father’s Day to all, including my worst and most vicious critics, of which there are fewer and fewer. This is a FANTASTIC time to be an American! KEEP AMERICA GREAT!"
2019-06-16 13:39:22,Donald J. Trump,1140252529428717568,".....news is that at the end of 6 years, after America has been made GREAT again and I leave the beautiful White House (do you think the people would demand that I stay longer? KEEP AMERICA GREAT), both of these horrible papers will quickly go out of business &amp; be forever gone!"
2019-06-16 13:39:22,Donald J. Trump,1140252528304631808,"A poll should be done on which is the more dishonest and deceitful newspaper, the Failing New York Times or the Amazon (lobbyist) Washington Post! They are both a disgrace to our Country, the Enemy of the People, but I just can’t seem to figure out which is worse? The good....."
2019-06-16 11:39:52,Donald J. Trump,1140222456466198528,.....saying enough. Democrat voters want to hear the politicians talking about issues. This is a huge distraction and will only help Donald Trump get elected.” @JedediahBila  “Greatest President since Ronald Reagan” said a counter-protester. LehighValleyLive
2019-06-16 11:39:51,Donald J. Trump,1140222451810492417,Yesterday was the Radical Left Democrats big Impeachment day. They worked so hard to make it something really big and special but had one problem - almost nobody showed up. “The Media admits low turnout for anti-Trump rallies.” @FoxNews  “All around the Country people are.......
2019-06-16 11:03:13,Donald J. Trump,1140213231203622914,Congratulations to great guy Pete Hegseth and wonderful Jenny Cunningham on their engagement. They will have a fantastic life together! @foxandfriends
2019-06-16 04:51:05,Donald J. Trump,1140119581983481856,"....More and more states want to do this but their governors and leaders don’t have the courage to do so. The politics will soon mandate, however, because people from California, &amp; all over the land, are demanding that Sanctuary Cities be GONE. No illegals, Drugs or Trafficking!"
2019-06-16 04:51:04,Donald J. Trump,1140119579118751744,"Florida Governor Ron DeSantis just signed Bill banning Sanctuary Cities in State, &amp; forcing all law enforcement agencies to cooperate with Federal Immigration authorities. Bill prohibits local Gov’t from enacting Sanctuary policies that protect undocumented immigrants...@FoxNews"
2019-06-16 01:15:24,Donald J. Trump,1140065304019644427,".....ALSO, NOT TRUE! Anything goes with our Corrupt News Media today. They will do, or say, whatever it takes, with not even the slightest thought of consequence! These are true cowards and without doubt, THE ENEMY OF THE PEOPLE!"
2019-06-16 01:15:23,Donald J. Trump,1140065300186128384,"Do you believe that the Failing New York Times just did a story stating that the United States is substantially increasing Cyber Attacks on Russia. This is a virtual act of Treason by a once great paper so desperate for a story, any story, even if bad for our Country....."
2019-06-16 00:51:20,Donald J. Trump,1140059246781968385,".....the first 2 1/2 years of his Presidency, including the fact that we have one of the best Economies in the history of our Country. It is called Earned Media. In any event, enjoy the show!"
2019-06-16 00:51:20,Donald J. Trump,1140059245456633858,"....misleading in that I personally spent only a small fraction of that time doing interviews. I do have a few other things to do, you know!). Think I will do many more Network Interviews, as I did in 2016, in order to get the word out that no President has done what I have in..."
2019-06-16 00:51:19,Donald J. Trump,1140059243518865408,"I enjoyed my interview with @GStephanopoulos on @ABC. So funny to watch the Fake News Media try to dissect &amp; distort every word in as negative a way as possible. It will be aired on Sunday night at 8:00 P.M., and is called, “President Trump: 30 Hours” (which is somewhat...."
2019-06-15 23:17:09,Donald J. Trump,1140035545738989569,He is a national disgrace who is destroying the City of London! https://t.co/l3qcUS17jh
2019-06-15 23:07:00,Donald J. Trump,1140032992074768384,RT @PressSec: I am blessed and forever grateful to @realDonaldTrump for the opportunity to serve and proud of everything he’s accomplished.…
2019-06-15 19:04:33,Donald J. Trump,1139971974854258688,The Corrupt News Media is totally out of control - they have given up and don’t even care anymore. Mainstream Media has ZERO CREDIBILITY - TOTAL LOSERS!
2019-06-15 18:50:40,Donald J. Trump,1139968481921851392,https://t.co/jlmmOCxk9H
2019-06-15 18:47:35,Donald J. Trump,1139967706424369152,LONDON needs a new mayor ASAP. Khan is a disaster - will only get worse! https://t.co/n7qKI3BbD2
2019-06-15 18:45:01,Donald J. Trump,1139967059503329282,Thank you Steve &amp; family! https://t.co/1lgfJjHRfH
2019-06-15 18:44:37,Donald J. Trump,1139966959716577280,RT @SteveScalise: For weeks Republicans have asked for an emergency funding bill to help fix the worsening border crisis. Immediate action…
2019-06-15 13:44:20,Donald J. Trump,1139891393252474880,"The Trump Economy is setting records, and has a long way up to go....However, if anyone but me takes over in 2020 (I know the competition very well), there will be a Market Crash the likes of which has not been seen before! KEEP AMERICA GREAT"
2019-06-15 12:55:47,Donald J. Trump,1139879172170539009,“President Trump to launch 2020 Campaign in Florida!”  @foxandfriends  Tuesday will be a Big Crowd and Big Day!
2019-06-15 12:51:34,Donald J. Trump,1139878112701927424,All in for Senator Steve Daines as he proposes an Amendment for a strong BAN on burning our American Flag. A no brainer!
2019-06-15 12:05:17,Donald J. Trump,1139866464599642112,"Despite the Greatest Presidential Harassment of all time by people that are very dishonest and want to destroy our Country, we are doing great in the Polls, even better than in 2016, and will be packed at the Tuesday Announcement Rally in Orlando, Florida. KEEP AMERICA GREAT!"
2019-06-15 11:51:27,Donald J. Trump,1139862983553757184,RT @DanScavino: Dems will keep their (embarrassing) games going on here in THE SWAMP until 2020 because they hate Trump &amp; they think it hel…
2019-06-15 11:50:33,Donald J. Trump,1139862755383500800,RT @DanScavino: President @realDonaldTrump stayed after his commencement speech at the @AF_Academy in Colorado Springs this past Thursday t…
2019-06-15 11:50:18,Donald J. Trump,1139862693450436608,"RT @DanScavino: .@realDonaldTrump stops by for an impromptu photo with local school kids in Ireland, who were hoping to catch a glimpse of…"
2019-06-15 11:49:53,Donald J. Trump,1139862587963858944,RT @DanScavino: As the worst Mayor in the history of New York City manages his bucket list in Iowa — he also remains steady at ZERO PERCENT…
2019-06-15 11:49:20,Donald J. Trump,1139862449556000768,RT @DanScavino: https://t.co/85xnJ7mpp7
2019-06-15 11:49:05,Donald J. Trump,1139862388180758528,"RT @DanScavino: NEVER GETS OLD....
https://t.co/SJQE8zxoCm"
2019-06-15 11:48:36,Donald J. Trump,1139862264511717376,RT @WhiteHouse: NEXT UP: President @realDonaldTrump speaks on expanding health coverage options for small businesses &amp; workers. https://t.c…
2019-06-15 11:47:12,Donald J. Trump,1139861914564157441,"RT @TeamTrump: Today, President @realDonaldTrump spoke on expanding health coverage options for American small businesses &amp; workers.

Presi…"
2019-06-15 11:46:00,Donald J. Trump,1139861610196066304,RT @CLewandowski_: Great to see a strong showing in NH for @realDonaldTrump on his Birthday.  Happy Birthday @realDonaldTrump https://t.co/…
2019-06-15 11:44:47,Donald J. Trump,1139861307002368000,"“With over a 50% Approval Rating at this point in his Presidency, analysts believe re-election in 2020 looks (very) promising!” @OANN  Hey, we have accomplished more than any President in the first 2 1/2 years, WHY NOT?"
2019-06-28 16:56:15,Barack Obama,1144650730256683009,"50 years ago, history was written at the Stonewall Inn when New York's LGBT community stood up, spoke out, and started a movement. In 2016 I was proud to designate it as a national monument—a reminder the arc of our history is an arc of progress as long as we keep pushing for it. https://t.co/xyvYfuoJwK"
2019-06-27 20:08:06,Barack Obama,1144336622814674951,What a gift to come across this interview with Julia “Hurricane” Hawkins. I’m as grateful for her life advice as I am impressed by her 100-meter dash time. https://t.co/8lc9Cimqyt
2019-06-21 18:13:24,Barack Obama,1142133432698454018,"Now we’re talking! Congrats to Team USA for moving on, and thanks for continuing to make us all proud. #USA https://t.co/DVkKBfU6wA"
2019-06-19 17:01:20,Barack Obama,1141390520956194816,"On Juneteenth, we celebrate our capacity to make real the promise of our founding, that thing inside each of us that says America is not yet finished, that compels all of us to fight for justice and equality until this country we love more closely aligns with our highest ideals. https://t.co/2XAKRuRrbG"
2019-06-19 17:00:44,Barack Obama,1141390367352401920,"Outside the Oval Office, I kept a painting of a small crowd huddled around a pocketwatch, waiting for the moment the Emancipation Proclamation took effect. On Juneteenth, we celebrate the anniversary of that news - freedom - reaching slaves in Texas. And something more: https://t.co/kSkLHbfnc3"
2019-06-18 18:17:55,Barack Obama,1141047405560942592,"This is worth a read: a thought-provoking reminder that education reform isn’t a cure-all. As a supporter of education reform, I agree that fixing educational inequality requires doing more to address the broader, systemic sources of economic inequality. https://t.co/96B7fkBM4u"
2019-06-16 18:08:20,Barack Obama,1140320216041316352,"Yes we can, Greta. I’m hopeful because of you and all the young people who are fighting to protect the planet. Keep at it. https://t.co/sUBwC0uNW8"
2019-06-16 13:47:03,Barack Obama,1140254463183249409,"Happy Father’s Day to Charles, one of our @ObamaFoundation Fellows, and all the dads at Fathers’ Uplift. Today, we’re celebrating fathers like these who provide a powerful example—not only for their kids, but for the rest of us, too. https://t.co/GJsxi8DozY"
2019-06-14 21:58:49,Barack Obama,1139653443709263872,RT @ObamaFoundation: These young people want to take action and make a change. Through the #CommunityLeadership Corps in Chicago and Hartfo…
2019-06-11 16:15:32,Barack Obama,1138479890389458945,"The @USWNT is something to smile about. It was great to celebrate with them back in 2015 and I'm excited to root them on in their drive to earn their fourth star. Best of luck to these champions for equality, on and off the field. #OneNationOneTeam https://t.co/AHcHGATy5S"
2019-06-10 15:52:11,Barack Obama,1138111627063169025,"Six years ago, David Ortiz's spirit and resolve helped us all begin to heal from the Boston Marathon bombing. Today, I want to join many others in wishing him a speedy recovery of his own. Get well soon, Papi. https://t.co/9orpBgnVI5"
2019-06-07 14:27:18,Barack Obama,1137003102576488450,"Last week, it was Virginia Beach. But day after day and year after year, too many families and communities are shattered by senseless gun violence. We can't get numb to this. On National Gun Violence Awareness Day, pledge to speak out, #WearOrange — and vote — to protect lives."
2019-06-06 22:57:02,Barack Obama,1136768992448778242,"RT @ObamaFoundation: Courage is contagious. Watch some of the courageous students who won our first-ever Civic Action Recognition Awards, h…"
2019-06-04 17:26:50,Barack Obama,1135961119066079234,"You've got a lot to be proud of, Jiwandeep. Thanks for everything you do to make this country a little more equal. Turban looks great, by the way. Happy Pride Month, everybody! https://t.co/SO7mgnOkgl"
2019-06-03 20:59:36,Barack Obama,1135652276515823617,What a life. American history has always been driven by visionaries like Leah Chase—and all the men and women who worked and ate at Dooky Chase’s over the years—folks who serve up progress one bowl of gumbo at a time. https://t.co/2LpuIbxvHk https://t.co/Y4i5snKjn7
2019-05-30 20:12:33,Barack Obama,1134190885036535809,"A story worth sharing: Twelve years ago, Brian joined my first presidential campaign. Two years ago, he was diagnosed with ALS and launched @iamalsorg to find a cure. Brian and Sandra wake up every day believing that we can win this fight—and that makes me hopeful, too. https://t.co/eETCgFnLgP"
2019-05-30 15:17:03,Barack Obama,1134116519066165249,"Exciting to see the faces of Colombia's future at an @ObamaFoundation roundtable with young leaders in Bogotá. Their creativity, their compassion, and their drive to improve their country are promising signs of what's to come. https://t.co/HrhreUuPMa"
2019-05-27 15:26:55,Barack Obama,1133031835880099840,"On Memorial Day, we remember all those who gave everything for something greater than themselves. It's up to us to not simply reflect on their sacrifice but to honor it with service of our own—and by living out the values they fought for. https://t.co/tZx3qcHnfV"
2019-05-23 14:07:16,Barack Obama,1131562241478864896,Great to get out there and take a few cuts at the plate yesterday—I had a blast with all these extraordinary young people. Thanks for letting me drop in and thanks to the Nationals Youth Academy for the outstanding work you do to support youth in DC. https://t.co/GKRMd8kZxm
