2018-11-01 21:20:50,Barack Obama,1058106616464240640,"Speaking of preexisting conditions, open enrollment starts today. If you or someone you know needs health care, visit https://t.co/ob1Ynoesod. Thanks to financial help, most people can find plans for $75/month or less, so check out your options and find a plan that works for you. https://t.co/R52X9sgkbP"
2018-11-01 18:32:47,Barack Obama,1058064323984179206,"Elections matter. You have the power to protect a family’s health care. Make a plan, grab some friends, and vote: https://t.co/rY8Ip1km9p"
2018-11-01 18:32:46,Barack Obama,1058064320356081665,"While we're talking about preexisting conditions, the ACA is the law that finally protected your coverage for preexisting conditions.

Those protections and your health care are absolutely at stake on Tuesday. Vote for Democrats who’ll protect them. https://t.co/BDDmY60u8k"
2018-10-31 18:20:55,Barack Obama,1057698949153349633,"Not sure who and what you can vote for? Head over to https://t.co/SHxg6ael0O to look up your state, learn who's running to represent you, which measures you can help decide, and more. Read up, and get ready to vote on November 6."
2018-10-30 15:44:20,Barack Obama,1057297156711813123,"Your vote can decide the health care of millions. Your voice can determine the character of our country. You have power — use it! In most states, you don't even have to wait until Election Day to cast a ballot. Find out where you can vote before Nov. 6: https://t.co/NKXRGNgbZX https://t.co/hWkFHqi49K"
2018-10-27 21:54:34,Barack Obama,1056303165610618880,"We grieve for the Americans murdered in Pittsburgh. All of us have to fight the rise of anti-Semitism and hateful rhetoric against those who look, love, or pray differently. And we have to stop making it so easy for those who want to harm the innocent to get their hands on a gun."
2018-10-17 17:21:34,Barack Obama,1052610585328869377,"The last presidential election turned on fewer than 100,000 votes in three states. More people go to Coachella. There’s no good excuse not to vote. Head over to https://t.co/zTCemnRMYV to check your registration, get your absentee ballot, and find out where to vote on November 6. https://t.co/LIQbltVJtz"
2018-10-12 01:51:01,Barack Obama,1050564463907270656,America is always at our best when we look out for each other. Please do what you can to help people recover and rebuild from Hurricane Michael. https://t.co/psmPZnmlqY
2018-10-11 14:01:16,Barack Obama,1050385850792640512,"I’m so proud of the work @MichelleObama has done over the years to ensure adolescent girls have access to education, and I know that the @GirlsAlliance will be another great chapter in her effort to get girls the opportunities they deserve. https://t.co/Ohv6NAylo4"
2018-10-09 03:47:49,Barack Obama,1049506695339229186,Congratulations to Drew Brees on the all time passing record. Always a class act.
2018-10-03 19:08:58,Barack Obama,1047564181266939905,"Happy Anniversary, @MichelleObama. For 26 years, you’ve been an extraordinary partner, someone who can always make me laugh, and my favorite person to see the world with. https://t.co/s8xoZ9j2YR"
2018-10-01 16:46:18,Barack Obama,1046803503988006912,"Today, I’m proud to endorse even more Democratic candidates who aren’t just running against something, but for something—to expand opportunity for all of us and to restore dignity, honor, and compassion to public service. They deserve your vote: https://t.co/NO5jnhX3XD"
2018-09-29 16:29:29,Barack Obama,1046074495201693697,"From civil servants to organizers, the young people I met in Amsterdam today are doing the hard work of change. And they keep at it for their communities, their countries, and the collective future of Europe and the world. Keep up the good work. https://t.co/AVtuBPHdr2"
2018-09-25 20:49:10,Barack Obama,1044690296917962754,"The antidote to government by a powerful few is government by the organized, energized many. This National Voter Registration Day, make sure you're registered, vote early if you can, or show up on November 6. This moment is too important to sit out."
2018-09-14 16:20:47,Barack Obama,1040636488445255680,"The first class of Obama Fellows is full of leaders like Keith—hardworking, innovative, and dedicated to partnering with their communities to drive transformational change. https://t.co/FN794E7Cqs"
2018-09-11 13:52:34,Barack Obama,1039512025406349312,"We will always remember everyone we lost on 9/11, thank the first responders who keep us safe, and honor all who defend our country and the ideals that bind us together. There's nothing our resilience and resolve can’t overcome, and no act of terror can ever change who we are."
2018-09-08 16:26:57,Barack Obama,1038463712506667008,"RT @nowthisnews: If you still don't think the midterms will affect you, @BarackObama is back to spell out just how important they are https…"
2018-09-07 15:08:22,Barack Obama,1038081548833222658,"Today I’m at the University of Illinois to deliver a simple message to young people all over the country: You need to vote, because our democracy depends on it. I hope you'll tune in at 11am CT: https://t.co/34WjNaVAcU"
2018-08-29 19:54:41,Barack Obama,1034892109868945409,Yesterday I met with high school students on Chicago’s Southwest side who spent the summer learning to code some pretty cool apps. Michelle and I are proud to support programs that invest in local youth and we’re proud of these young people. https://t.co/dQnDgswCj5
2018-08-26 21:40:29,Barack Obama,1033831571944554498,Congratulations to Hawaii for winning the Little League World Series! You make America very proud. 🤙🏾 https://t.co/8Un7LPXgX1
2018-08-26 01:09:45,Barack Obama,1033521851312623616,Our statement on the passing of Senator John McCain: https://t.co/3GBjNYxoj5
2018-08-16 16:31:18,Barack Obama,1030129887623958538,"Aretha helped define the American experience. In her voice, we could feel our history, all of it and in every shade—our power and our pain, our darkness and our light, our quest for redemption and our hard-won respect. May the Queen of Soul rest in eternal peace. https://t.co/bfASqKlLc5"
2018-08-06 14:53:32,Barack Obama,1026481404782235648,"Bobby Kennedy was one of my heroes. He was someone who showed us the power of acting on our ideals, the idea that any of us can be one of the “million different centers of energy and daring” that ultimately combine to change the world for the better. https://t.co/nAiPiGercs"
2018-08-01 16:20:24,Barack Obama,1024691324933562369,"I’m confident that, together, they’ll strengthen this country we love by restoring opportunity, repairing our alliances and standing in the world, and upholding our fundamental commitment to justice, fairness, responsibility, and the rule of law. But first, they need our votes."
2018-08-01 16:20:04,Barack Obama,1024691241093607425,"Today I’m proud to endorse such a wide and impressive array of Democratic candidates – leaders as diverse, patriotic, and big-hearted as the America they’re running to represent: https://t.co/gWzalQhFas"
2018-07-18 16:19:30,Barack Obama,1019617669958586368,"Mandela Day is about taking action to change the world for the better. In these young people, I see Madiba's example of persistence and hope. They are poised to make this world more peaceful, more prosperous, and more just. https://t.co/GJDuOs1hkH"
2018-07-13 13:42:22,Barack Obama,1017766186296193024,"This week, I’m traveling to Africa for the first time since I left office – a continent of wonderful diversity, thriving culture, and remarkable stories. As I prepare for this trip, I wanted to share a list of books that I’d recommend for summer reading: https://t.co/W4Jc0N23iy"
2018-06-18 17:52:50,Barack Obama,1008769520759173121,RT @MichelleObama: Sometimes truth transcends party. https://t.co/TeFM7NmNzU
2018-06-12 15:09:54,Barack Obama,1006554191676964864,"Congratulations to the @Capitals! This @NHLBlackhawks fan knows what it’s like to lift that cup – and I’m happy for all the Caps fans who cheer so hard for their team, and for a team that celebrates so hard with its fans."
2018-06-08 16:01:17,Barack Obama,1005117568913412098,"“Low plastic stool, cheap but delicious noodles, cold Hanoi beer.” This is how I’ll remember Tony. He taught us about food — but more importantly, about its ability to bring us together. To make us a little less afraid of the unknown. We’ll miss him. https://t.co/orEXIaEMZM"
2018-06-01 15:33:58,Barack Obama,1002573982212788224,"This National Gun Violence Awareness Day, show your commitment to keeping our kids safe from gun violence. Then, for everyone we’ve lost, take action to change our leadership and our laws until they reflect that commitment - no matter how long it takes. https://t.co/lraIwlQAgl"
2018-05-28 16:02:01,Barack Obama,1001131488103030784,"We can never truly repay the debt we owe our fallen heroes. But we can remember them, honor their sacrifice, and affirm in our own lives those enduring ideals of justice, equality, and opportunity for which generations of Americans have given that last full measure of devotion. https://t.co/pRxwmaMClL"
2018-05-23 20:40:01,Barack Obama,999389510550028289,This Center is for the leaders of tomorrow who are ready to step up and build the world as it should be. Michelle and I are grateful to Chicagoans and the Chicago City Council for making it happen. https://t.co/86uiJ55azV
2018-05-13 14:32:16,Barack Obama,995673081531248642,"Happy Mother’s Day to every mom out there, especially the remarkable moms in my life, @MichelleObama and my mother-in-law, Marian Robinson. https://t.co/n65fyWg7O8"
2018-05-08 19:40:56,Barack Obama,993938824752451586,There are few issues more important to the security of the US than the potential spread of nuclear weapons or the potential for even more destructive war in the Middle East. Today’s decision to put the JCPOA at risk is a serious mistake. My full statement: https://t.co/4oTdXESbxe
2018-05-02 16:00:44,Barack Obama,991709079600091136,RT @MichelleObama: Happy #CollegeSigningDay! So excited to be in Philly to celebrate all the young people making the commitment to higher e…
2018-04-23 19:13:36,Barack Obama,988496127996678145,"These talented young people will create a better future not just in Africa, but around the world. I can’t wait to spend some time with @ObamaFoundation Leaders and look forward to honoring the Mandela legacy in Johannesburg this summer. https://t.co/b73wGIW4Gj"
2018-04-18 00:44:58,Barack Obama,986405191711944704,Our statement on the passing of Former First Lady Barbara Bush: https://t.co/MhTVYCL9Nj
2018-04-16 11:25:04,Barack Obama,985841501321269250,RT @ObamaFoundation: We just announced the inaugural class of #ObamaFellows. These 20 civic leaders have carried out inspiring work around…
2018-04-04 14:35:58,Barack Obama,981540886726217729,"RT @ObamaFoundation: This week—50 years since Dr. Martin Luther King, Jr. was killed—@BarackObama and @RepJohnLewis sat down with a group o…"
2018-03-25 15:34:31,Barack Obama,977931743880761344,Incredible to have a Chicago team in the Final Four. I’ll take that over an intact bracket any day! Congratulations to everybody @LoyolaChicago - let’s keep it going!
2018-03-24 17:07:47,Barack Obama,977592827348742146,Michelle and I are so inspired by all the young people who made today’s marches happen. Keep at it. You’re leading us forward. Nothing can stand in the way of millions of voices calling for change.
2018-03-19 21:48:18,Barack Obama,975851480648421376,"Our most important task as a nation is to make sure all our young people can achieve their dreams. We’ve started this work with @MBK_Alliance, but there’s so much more all of us have to do—government, private sector, academia &amp; community leaders—to change the odds for our kids. https://t.co/7f7A0HmK50"
2018-03-19 15:10:02,Barack Obama,975751255296487424,"In Singapore with young people who are advocating for education, empowering young women, and getting involved all over Southeast Asia with a profoundly optimistic commitment to building the world they want to see. https://t.co/so4Uqouu8M"
2018-03-16 00:22:18,Barack Obama,974440685175754752,41: I like the competition. And the loyalty to the home team. - 44 https://t.co/XG3ChMtW0M
2018-03-15 23:16:02,Barack Obama,974424008182689792,Congrats to @LoyolaChicago and Sister Jean for a last-second upset - I had faith in my pick!
2018-03-14 20:12:59,Barack Obama,974015556675391488,"Just because I have more time to watch games doesn’t mean my picks will be better, but here are my brackets this year: https://t.co/ETRchPcZxF https://t.co/gnNXw0Ysxr"
2018-03-14 14:58:59,Barack Obama,973936533320413184,Have fun out there among the stars. https://t.co/S285MTwGtp
2018-03-12 18:12:41,Barack Obama,973260504411058176,"Four years ago, @MichelleObama and I had the privilege to host Lt. Cmdr. Dan Cnossen and his fellow Paralympians and Olympians at the White House. Today, we’re so proud of him for winning gold and silver - while still representing the red, white, and blue. https://t.co/evDCV7zehM"
2018-02-28 02:58:41,Barack Obama,968681836078608385,"I got my start holding community meetings in Chicago, so it was fun to be home for one tonight. Michelle and I want the world to come together on the South Side at a place built with local ideas, values, and hopes. That’s the @ObamaFoundation and Presidential Center. https://t.co/ccwkqAY7P5"
2018-02-22 16:00:44,Barack Obama,966704319658647553,"Young people have helped lead all our great movements. How inspiring to see it again in so many smart, fearless students standing up for their right to be safe; marching and organizing to remake the world as it should be. We've been waiting for you. And we've got your backs."
2018-02-21 16:33:04,Barack Obama,966350067287363584,"Billy Graham was a humble servant who prayed for so many - and who, with wisdom and grace, gave hope and guidance to generations of Americans."
2018-02-15 17:12:17,Barack Obama,964185606803853314,"We are grieving with Parkland. But we are not powerless. Caring for our kids is our first job. And until we can honestly say that we're doing enough to keep them safe from harm, including long overdue, common-sense gun safety laws that most Americans want, then we have to change."
2018-02-14 16:25:03,Barack Obama,963811333685817346,"Happy Valentine’s Day, @MichelleObama. You make every day and every place better. https://t.co/aWvyytR7Mm"
2018-02-14 16:24:22,Barack Obama,963811162482728961,"RT @MichelleObama: Happy #ValentinesDay to my one and only, @BarackObama. To celebrate the occasion, I’m dedicating a little Valentine’s Da…"
2018-01-15 14:46:02,Barack Obama,952914779458424832,"Dr. King was 26 when the Montgomery bus boycott began. He started small, rallying others who believed their efforts mattered, pressing on through challenges and doubts to change our world for the better. A permanent inspiration for the rest of us to keep pushing towards justice."
2017-12-29 16:11:11,Barack Obama,946775615893655552,"All across America people chose to get involved, get engaged and stand up. Each of us can make a difference, and all of us ought to try. So go keep changing the world in 2018."
2017-12-29 16:10:36,Barack Obama,946775467536928768,"Ten-year-old Jahkil Jackson is on a mission to help homeless people in Chicago. He created kits full of socks, toiletries, and food for those in need. Just this week, Jahkil reached his goal to give away 5,000 “blessing bags.” That’s a story from 2017. https://t.co/muxPZnEGkd"
2017-12-29 16:10:04,Barack Obama,946775332564230144,"Chris Long gave his paychecks from the first six games of the NFL season to fund scholarships in Charlottesville, VA. He wanted to do more, so he decided to give away an entire season’s salary. That’s a story from 2017. https://t.co/NL0RoARkan"
2017-12-29 16:09:31,Barack Obama,946775194101800960,"Kat Creech, a wedding planner in Houston, turned a postponed wedding into a volunteer opportunity for Hurricane Harvey victims. Thirty wedding guests became an organization of hundreds of volunteers. That’s a story from 2017. https://t.co/yxhjwkr5Se"
2017-12-29 16:09:04,Barack Obama,946775081371471872,"As we count down to the new year, we get to reflect and prepare for what’s ahead. For all the bad news that seemed to dominate our collective consciousness, there are countless stories from this year that remind us what's best about America."
2017-12-27 21:02:52,Barack Obama,946124244328550400,"RT @MBK_Alliance: I am my Brother’s Keeper. 
Watch our new PSA with @BarackObama, @StephenCurry30 &amp; @chancetherapper, then take action to s…"
2017-12-25 16:05:05,Barack Obama,945324527520804866,"On behalf of the Obama family, Merry Christmas! We wish you joy and peace this holiday season. https://t.co/CNFUZrhrBj"
2017-12-14 22:39:13,Barack Obama,941437447296225280,There's no better time than the holiday season to reach out and give back to our communities. Great to hear from young people at the Boys &amp; Girls Club in DC today. https://t.co/FSJkj1qwg9
2017-12-13 00:17:20,Barack Obama,940737366255423488,"Happy Hanukkah, everybody, from the Obama family to yours. Chag Sameach!"
2017-12-11 20:16:29,Barack Obama,940314364460060673,Just got off a call to thank folks who are working hard to help more Americans across the country sign up for health coverage. But it's up to all of us to help spread the word: Sign up through this Friday at https://t.co/ob1Ynoesod. https://t.co/8TYpLCestp
2017-12-04 22:57:47,Barack Obama,937818240453095424,RT @ObamaFoundation: Watch: We hosted a Town Hall in New Delhi with @BarackObama and young leaders about how to drive change and make an im…
2017-11-27 21:13:50,Barack Obama,935255366438408192,Michelle and I are delighted to congratulate Prince Harry and Meghan Markle on their engagement. We wish you a lifetime of joy and happiness together.
2017-11-23 14:44:27,Barack Obama,933707825821421568,"From the Obama family to yours, we wish you a Happy Thanksgiving full of joy and gratitude. https://t.co/xAvSQwjQkz"
2017-11-20 19:02:11,Barack Obama,932685522820042754,"ME:  Joe, about halfway through the speech, I’m gonna wish you a happy birth--
BIDEN:  IT’S MY BIRTHDAY!
ME:  Joe.
 
Happy birthday to @JoeBiden, my brother and the best vice president anybody could have. https://t.co/sKbXjNiEjH"
2017-11-11 15:13:46,Barack Obama,929366549009502208,"RT @ObamaFoundation: Today, we honor those who have honored our country with its highest form of service. https://t.co/IbJNCwIofL https://t…"
2017-11-08 13:25:21,Barack Obama,928252100081078272,"This is what happens when the people vote. Congrats @RalphNortham and @PhilMurphyNJ . And congratulations to all the victors in state legislative, county and mayors' races. Every office in a democracy counts!"
2017-11-07 01:02:17,Barack Obama,927702713298759680,Every election matters - those who show up determine our future. Go vote tomorrow! https://t.co/j1wh8hLamw
2017-11-06 00:51:32,Barack Obama,927337619406643200,May God also grant all of us the wisdom to ask what concrete steps we can take to reduce the violence and weaponry in our midst.
2017-11-06 00:51:09,Barack Obama,927337524808347648,"We grieve with all the families in Sutherland Springs harmed by this act of hatred, and we’ll stand with the survivors as they recover..."
2017-11-01 13:06:59,Barack Obama,925710762894680064,"Starting today, you can sign up for 2018 health coverage. Head on over to https://t.co/ob1Ynoesod and find a plan that meets your needs. https://t.co/6vYt83w74T"
2017-11-01 00:56:44,Barack Obama,925526988659548160,Michelle and I are thinking of the victims of today's attack in NYC and everyone who keeps us safe. New Yorkers are as tough as they come.
2017-10-30 21:36:12,Barack Obama,925114135548919808,"Hello, #ObamaSummit! Thrilled to host civic leaders in Chicago from all over the world. Follow along at @ObamaFoundation."
2017-10-23 22:03:41,Barack Obama,922584337815613441,"I’ll let you and @ladygaga handle the singing, and we’ll handle the donations. There’s still time to give: https://t.co/o5oCWOtiJS. https://t.co/uKCBwAL2hs"
2017-10-22 00:02:08,Barack Obama,921889369337860096,Tonight the ex-Presidents are getting together in Texas to support all our fellow Americans rebuilding from this year’s hurricanes. Join us. https://t.co/RShkuueyoj
2017-10-16 22:59:00,Barack Obama,920061541986250758,"I'm grateful to @SenJohnMcCain for his lifetime of service to our country. Congratulations, John, on receiving this year's Liberty Medal."
2017-10-02 12:41:16,Barack Obama,914832655170011137,Michelle &amp; I are praying for the victims in Las Vegas. Our thoughts are with their families &amp; everyone enduring another senseless tragedy.
2017-09-30 02:22:08,Barack Obama,913952069765271559,Proud to cheer on Team USA at the Invictus Games today with my friend Joe. You represent the best of our country. https://t.co/WBzcltmgqj
2017-09-26 17:03:55,Barack Obama,912724426709504000,"We're expanding our efforts to help Puerto Rico &amp; the USVI, where our fellow Americans need us right now. Join us at https://t.co/o5oCWOtiJS https://t.co/L2xArjc9N7"
2017-09-25 23:36:36,Barack Obama,912460861758955523,"Prosecutor, soldier, family man, citizen. Beau made us want to be better. What a legacy to leave. What a testament to @JoeBiden. https://t.co/078Pt7evMZ"
2017-09-20 16:32:34,Barack Obama,910542207991590917,RT @gatesfoundation: President @BarackObama addresses #Goalkeepers17 starting at 12:40 PM. Tune in here: https://t.co/XmHBErSHYw
2017-09-20 02:30:52,Barack Obama,910330388219916290,Thinking about our neighbors in Mexico and all our Mexican-American friends tonight. Cuidense mucho y un fuerte abrazo para todos.
2017-09-18 20:07:58,Barack Obama,909871642423197696,"Coding is important – and fun. @CSforAll, thanks for your work to make sure every kid can compete in a high-tech, global economy. https://t.co/QDZqcoEQiM"
2017-09-13 14:08:59,Barack Obama,907969359695491072,Michelle and I want the @ObamaFoundation to inspire and empower people to change the world. Here's how we're getting started this fall. https://t.co/Q8a4voDXjV
