2019-05-20 23:04:03,Barack Obama,1130610163889713152,"RT @ObamaFoundation: Congratulations on the inauguration of @ChicagosMayor Lori Lightfoot, Treasurer Melissa Conyears-Ervin, @ChiCityClerk…"
2019-05-20 18:50:12,Barack Obama,1130546280286117890,"Here’s a great story: While we’ve still got a lot of work to do to make college affordable for everyone, that didn’t stop Robert F. Smith from seizing an opportunity to make a difference. He’s erasing the student loan debt for this year’s @Morehouse grads. https://t.co/I3X38Pbpjz"
2019-05-12 15:32:16,Barack Obama,1127597365978959872,"Happy Mother's Day to the most caring, brilliant, funny, and grounded woman I know—a perfect role model not just for our daughters, but so many others. Love you, @MichelleObama. https://t.co/liWmYaEPVk"
2019-05-09 16:18:19,Barack Obama,1126521793211248640,"As part of the @ObamaFoundation, moms like Dr. Mwansa Ketty Lubeya are answering the call for change—and raising the next generation of leaders while they’re at it. https://t.co/llToyKG2Y7"
2019-05-06 16:18:57,Barack Obama,1125434787890700290,"RT @MichelleObama: Congratulations, Meghan and Harry! Barack and I are so thrilled for both of you and can't wait to meet him. #RoyalBaby h…"
2019-05-01 20:50:43,Barack Obama,1123691238803288066,"Happy #CollegeSigningDay, everybody! I'm proud of every student out there who's taking the next step in their education. It's the best thing you can do for yourself and your future. https://t.co/SZQaUG2Zze"
2019-04-30 20:31:44,Barack Obama,1123324075387052032,"Condolences to the family of John Singleton. His seminal work, Boyz n the Hood, remains one of the most searing, loving portrayals of the challenges facing inner-city youth. He opened doors for filmmakers of color to tell powerful stories that have been too often ignored."
2019-04-30 14:53:16,Barack Obama,1123238896882651137,"Congratulations to the new class of @ObamaFoundation Fellows! Their work in every region of the globe is already making the world better, and I hope this experience helps them make an even bigger impact. https://t.co/azK2Y9Iw5c https://t.co/tuKO1SFhSK"
2019-04-28 19:16:19,Barack Obama,1122580319109091328,"For thirty-six years, Richard Lugar proved that pragmatism and decency work—not only in Washington but all over the world. Michelle and I send our warmest sympathies to his family and all those who had the privilege of knowing this American statesman. https://t.co/Oy5DzPwkGb"
2019-04-23 21:02:20,Barack Obama,1120795062668075009,Dominique’s story is a reminder to us that where you’re from shouldn’t define what you can achieve. I’m proud of her and all students striving for a better future. https://t.co/eD95oWrOk4
2019-04-22 19:40:43,Barack Obama,1120412132036706305,"This generation of climate activists is tired of inaction, and they've caught the attention of leaders all over the world. So while this challenge is only getting more urgent, they show us the kind of action it'll take to meet this moment."
2019-04-22 19:40:10,Barack Obama,1120411993905799171,"And in the U.S., 13-year old @AlexandriaV2005 of New York, 13-year old @havenruthie of Denver, and 16-year old @israhirsi of Minneapolis are some of the young people leading the fight at home. I hope more of us will follow their example. https://t.co/qe08CGHBEI"
2019-04-22 19:39:36,Barack Obama,1120411854420041729,"I met 23-year-old @luisamneubauer in Berlin earlier this month. Luisa, the organizer behind the student movement in Germany, says, “It’s our future and we’re not going to stop fighting for it.” https://t.co/hS03PCWYAq"
2019-04-22 19:39:08,Barack Obama,1120411734316023809,"They're people like 16-year-old @GretaThunberg, whose protests at Swedish parliament sparked a movement. Inspired by Greta's action, Fridays for Future brought together more than a million strikers on every continent last month to demand action on climate. https://t.co/un7nBhEF8i"
2019-04-22 19:38:41,Barack Obama,1120411621304750088,"Young people all over the world are leading the way in the fight to protect our planet because they know their future depends on it. This Earth Day, I want to celebrate the courageous, committed young leaders who are stepping up to save the one planet we've got."
2019-04-21 15:56:03,Barack Obama,1119993208149282818,"To all who celebrate today, happy Easter from our family to yours! On this day of rebirth and renewal, let’s recommit to love and serve our brothers and sisters, especially those in need, in every way we can. Have a great day, everybody. https://t.co/BtMyWebGLw"
2019-04-21 14:02:46,Barack Obama,1119964696810070017,"The attacks on tourists and Easter worshippers in Sri Lanka are an attack on humanity. On a day devoted to love, redemption, and renewal, we pray for the victims and stand with the people of Sri Lanka."
2019-04-15 20:25:32,Barack Obama,1117886698568830976,"Notre Dame is one of the world’s great treasures, and we’re thinking of the people of France in your time of grief. It’s in our nature to mourn when we see history lost – but it’s also in our nature to rebuild for tomorrow, as strong as we can. https://t.co/SpMEvv1BzB"
2019-04-14 18:44:50,Barack Obama,1117498965417656321,"Congratulations, Tiger! To come back and win the Masters after all the highs and lows is a testament to excellence, grit, and determination."
2019-04-12 23:08:21,Barack Obama,1116840506506514433,"Another good story worth sharing: From one ""kid from Akron"" to a new generation of Akron kids, some remarkable early achievements at @IPROMISESchool. Great work, @KingJames—and even better work by those students. Proud to be a witness to their success: https://t.co/ctWfKnA5GL"
2019-04-11 00:08:43,Barack Obama,1116130925396602880,"From a big NBA fan, congrats to future Hall of Famers Dwyane Wade and Dirk Nowitzki—not just all-time greats but class acts, too."
2019-04-06 13:16:18,Barack Obama,1114517185483898880,"In just a few minutes, I’m taking the stage at the @ObamaFoundation Town Hall Europe for a conversation about how to best support civic leaders carrying out good work across the continent. I hope you’ll tune in live at https://t.co/swMRHuB5Y4. https://t.co/Ds4I8wFFM1"
2019-04-05 16:25:09,Barack Obama,1114202323767701504,A voice everybody should hear. https://t.co/0u7HUlQ8id
2019-04-04 19:23:45,Barack Obama,1113884881807990789,Here’s a story about people doing good that's worth sharing: @BradPaisley and his wife @Kimwilliamspais saw food insecurity in Nashville and decided to do something about it. They just broke ground on a free grocery store to help families in need: https://t.co/o6pcAApZsm
2019-04-03 19:07:17,Barack Obama,1113518349483421696,"Great to see Chicago’s historic mayoral race between two highly qualified candidates. Congrats to our next mayor, Lori Lightfoot—and Toni Preckwinkle campaigned hard and did us proud. I know that with our city’s heart and Lori’s leadership, Chicago’s best days are still ahead."
2019-04-02 13:08:49,Barack Obama,1113065751748009984,"Valerie is one of my oldest friends and advisors – she was by my side when I first decided to run for office and for every major moment of the presidency. @ValerieJarrett's voice has often inspired me and I know “Finding My Voice” will inspire others to lift their voices, too. https://t.co/nWTBDByMoz"
2019-03-26 18:33:57,Barack Obama,1110610860513349633,"Last night I had the chance to meet with first-term Democrats in Congress—it's a young, diverse class, stocked with a bunch of my campaign and administration alums who’ve taken the torch. This group is going to be driving progress for a long time to come. https://t.co/W5dDlDtNzE"
2019-03-21 15:43:47,Barack Obama,1108756096733331456,"Just in the nick of time: My brackets have never been my one shining moment, but here we go again. You can check out my #MarchMadness picks here: https://t.co/c3bjNrIo4w https://t.co/EcCUdnZjun"
2019-03-20 14:20:35,Barack Obama,1108372768796626945,"And here are some ways to help cyclone victims in Mozambique, Malawi, and Zimbabwe: https://t.co/if8HZBtWBH"
2019-03-20 14:19:59,Barack Obama,1108372617562648576,The floods in the Midwest and in southern Africa are heartbreaking. Suffering and loss on two sides of the world calls for solidarity and strength from all of us. Ask what you can do to help our fellow Americans and families in need. Here are some ideas: https://t.co/jWJlKABqAb
2019-03-17 13:56:29,Barack Obama,1107279541741998081,"In 2011, I visited the tiny town of Moneygall and got to walk around in the house where my great-great-great grandfather Falmouth Kearney lived his early life. I'll always be grateful for the warmth and generosity of the Irish people. Happy St. Patrick's Day! -Barack O’Bama https://t.co/abDtarFbR5"
2019-03-15 13:15:44,Barack Obama,1106544510555824128,Michelle and I send our condolences to the people of New Zealand. We grieve with you and the Muslim community. All of us must stand against hatred in all its forms.
2019-03-14 20:36:39,Barack Obama,1106293084168601600,.@MichelleObama and I are rooting hard for Team USA as the Special Olympics World Games get underway this week. Our Special Olympians are terrific examples of America’s heart and drive.
2019-03-12 18:48:18,Barack Obama,1105541040575008768,"What a great moment. Happy 110th, Virginia. https://t.co/FuNZV3RRV4"
2019-03-11 01:02:11,Barack Obama,1104910353232789505,Michelle and I send our deepest sympathies to all who knew the victims of today’s plane crash in Ethiopia.
2019-03-08 16:03:23,Barack Obama,1104049983760805889,"The Crew Dragon’s been on quite a ride since I last saw it—congrats to @NASA and @SpaceX on a successful return! We invested in the @Commercial_Crew program to strengthen the U.S. space program for the long haul, and it’s great to see that happening. https://t.co/Dsu5mZcaCZ"
2019-03-08 13:34:30,Barack Obama,1104012516307451905,"Preethi, Alice, and Sefora are just three of many @ObamaFoundation leaders who remind us what International Women’s Day is all about: imagining a world free of artificial ceilings for the next generation—and doing the hard work to get us there."
2019-03-08 13:31:52,Barack Obama,1104011854437863424,"And @SeforaKodjo is helping the next generation of women leaders in Africa rise up. Her organization is training and mentoring young women across the continent to adopt a new model of leadership, one that puts gender equality at the heart of economic development. https://t.co/cRb4EKcrvv"
2019-03-08 13:31:15,Barack Obama,1104011700724994049,".@BarbeAlice is helping refugees resettle into welcoming communities in France, offering them job training and language immersion, as well as a place to stay. More importantly, she’s fighting a narrative that suggests our differences are more important than our shared humanity. https://t.co/jNIiKIAZaO"
2019-03-08 13:30:31,Barack Obama,1104011515227713538,".@preethiherman is helping women unleash their power to change their societies. As head of the https://t.co/3RwHe5Razz Foundation, she’s leading an initiative that combines online tools with in-person organizing, giving women a voice in her native India—and beyond. https://t.co/TKuAKVL5Y1"
2019-03-08 13:29:54,Barack Obama,1104011361099624448,"On International Women’s Day, I’m reflecting on the future we all want for our daughters: one where they can live out their aspirations without limits. And I’m celebrating some of the women who are building that future for all of us today."
2019-02-21 19:01:39,Barack Obama,1098659030204116992,It’s up to all of us as citizens to make sure that the rules of democracy are fair—everywhere—because the next decade of our nation's progress is on the line. Join me and @allontheline in the fight against gerrymandering: https://t.co/d7TYE8u0CD. https://t.co/rKchS3ltLI
2019-02-21 04:41:44,Barack Obama,1098442623239573505,Zion Williamson seems like an outstanding young man as well as an outstanding basketball player. Wishing him a speedy recovery.
2019-02-20 00:02:24,Barack Obama,1098009940436885506,I’m about to join @StephenCurry30 on stage with @MBK_Alliance to answer questions from boys and young men of color about the challenges that confront them and the opportunities within their grasp. Tune in at https://t.co/swMRHuB5Y4.
2019-02-18 20:05:12,Barack Obama,1097587860549570560,"RT @ObamaFoundation: Ahead of #MBKRising and in honor of Black History Month, @BarackObama shared a nonfiction reading list that can help t…"
2019-02-16 20:40:27,Barack Obama,1096871952512368642,"I’ve always loved basketball because it’s about building a team that’s equal to more than the sum of its parts. Glad to see this expansion into Africa because for a rising continent, this can be about a lot more than what happens on the court. https://t.co/lghcLaUN9a"
2019-02-14 18:32:00,Barack Obama,1096114852941234176,"Happy Valentine’s Day to the extraordinarily smart, beautiful, funny, one and only @MichelleObama. It’s true; she does get down to Motown. https://t.co/uypbZsEiqB"
2019-02-14 15:18:47,Barack Obama,1096066230442749952,"In the year since their friends were killed, the students of Parkland refused to settle for the way things are and marched, organized, and pushed for the way things should be - helping pass meaningful new gun violence laws in states across the country. I'm proud of all of them."
2019-02-14 03:10:37,Barack Obama,1095882980839616512,"Don’t be sad it’s over, be proud it taught us so much. Congrats to all the men and women of @NASA on a @MarsRovers mission that beat all expectations, inspired a new generation of Americans, and demands we keep investing in science that pushes the boundaries of human knowledge."
2019-02-13 01:18:20,Barack Obama,1095492333481705472,"Happy 85th birthday to @RealBillRussell - the greatest champion in American sports, and a lifelong warrior for justice."
2019-02-11 04:01:16,Barack Obama,1094808564437303297,RT @MichelleObama: A big part of friendship is showing up for your girls—that’s why I was thrilled to be there for the one and only @alicia…
2019-02-08 04:04:14,Barack Obama,1093722143513346048,My statement on the passing of former Congressman John Dingell: https://t.co/gjBYHHImzB
2019-02-08 04:03:33,Barack Obama,1093721973824339968,"We lost two great Americans today – Frank Robinson and John Dingell – citizens who inspired me and so many others by leading on the civil rights issues of our time, opening doors to others, and leaving it all on the field."
2019-02-01 16:08:02,Barack Obama,1091367581964034048,"As we celebrate Black History Month and Jackie Robinson’s 100th birthday, we celebrate the life of all whose courage opened the gates for everybody, and in the process, made America better. https://t.co/Fl9aDxqcGi"
2019-01-25 18:18:52,Barack Obama,1088863791058698240,The @ObamaFoundation is connecting people from around the world so they can form partnerships just like this. I am inspired by Robert and Vanessa and what’s possible when leaders come together to have an even greater impact on the world. https://t.co/hFAMzW7tBq
2019-01-21 16:14:42,Barack Obama,1087382991901474816,"I’ve always drawn inspiration from what Dr. King called life’s most persistent and urgent question: ""What are you doing for others?"" Let’s honor his legacy by standing up for what is right in our communities and taking steps to make a positive impact on the world."
2019-01-17 20:21:58,Barack Obama,1085995668668366848,RT @MBK_Alliance: President Obama challenged us to improve our communities in 2019—and mentorship is a concrete action we can take. With @M…
2019-01-17 15:02:10,Barack Obama,1085915185146150912,"I knew it way back then and I’m absolutely convinced of it today — you’re one of a kind, @MichelleObama. Happy Birthday! https://t.co/ejqm0uC9J4"
2019-01-01 16:19:34,Barack Obama,1080136459670175744,"In 2018 people stepped up and showed up like never before. Keep it up in 2019. We’ve got a lot of work to do, and I’ll be right there with you. Happy New Year, everybody!"
2018-12-29 16:15:20,Barack Obama,1079048231298883584,"I hope you find inspiration in the stories of Dejah, Moussa, Sandor, Hong and Jonny. Their journeys began with a decision to build the better future they wanted to see. The same is true for you. What matters isn’t the size of the step you take; what matters is that you take it."
2018-12-29 16:15:20,Barack Obama,1079048229382017024,"Leaders like Jonny Boucher, a Chicago native who, after losing too many friends and family to suicide, started a coffee shop to offer emotional support and guidance to those who might be in need of a little more than a strong cup of coffee to get through their day. https://t.co/H6XPceR6d9"
2018-12-29 16:15:20,Barack Obama,1079048228354457600,"Leaders like Hong Hoang, who mobilized a youth-led movement to create a greener world after becoming the first Vietnamese person to visit Antarctica. https://t.co/K8xPNC1OCQ"
2018-12-29 16:15:19,Barack Obama,1079048227448475649,"Leaders like Moussa Kondo and Sandor Lederer, who are each doing their part to fight corruption in their native countries of Mali and Hungary. Two people separated by continents but united in their pursuit of a more just, transparent society. https://t.co/YbOxSEyyCd"
2018-12-29 16:15:18,Barack Obama,1079048223342264320,"Leaders like Dejah Powell, who started an organization to bring health and wellness resources to communities on the South Side of Chicago, expanding food access and providing people the space and time to take care of themselves. https://t.co/tPW7NxTGLO"
2018-12-29 16:15:18,Barack Obama,1079048221861634048,"As the year winds down and we look toward 2019, I’m asking you to make a commitment: find something you want to change in your community and take the first step toward changing it. If you need some inspiration, take a look at some of the young leaders who inspired me this year."
2018-12-28 14:34:43,Barack Obama,1078660520650174464,"As 2018 draws to a close, I’m continuing the tradition of sharing my year-end lists. It gives me a moment to reflect on the year through the books, movies, and music that I found most thought-provoking, inspiring, or just plain loved. I hope you enjoy it: https://t.co/qz6TCMKnkL"
2018-12-25 14:14:37,Barack Obama,1077568301281263616,Enjoy the holiday season with the ones you love. Michelle and I wish you a very Merry Christmas! https://t.co/LKLqlYfFUw
2018-12-20 20:55:31,Barack Obama,1075857251066363905,"There’s no better time than the holidays to give back to your community. Yesterday I got to do just that at @ChildrensHealth. As we celebrate the season and look forward to 2019, let’s recommit to doing our part to build a world that is a little more generous, tolerant, and kind. https://t.co/77rcNoY8jn"
2018-12-19 21:48:12,Barack Obama,1075508118359076864,"Merry Christmas and happy holidays to the extraordinary kids, families, and staff at Children’s National. And thanks for humoring me as your stand-in Santa. https://t.co/mFmYCVk7cr"
2018-12-15 21:15:39,Barack Obama,1074050377291624449,Today is the last day of open enrollment. That means it’s the deadline to make sure you and the people you love have health insurance in 2019. So head over to https://t.co/ob1Ynoesod to get covered! Here’s what else you need to know today about health care: https://t.co/gosn6c6uCa
2018-12-15 00:58:26,Barack Obama,1073744054960250880,"Joe is right. Head to https://t.co/SS87NTsgJt before tomorrow’s deadline. And nice bracelet, by the way. https://t.co/NFy3LxZe3f"
2018-12-13 04:15:34,Barack Obama,1073068889339240450,"As Bobby Kennedy taught us, the thing about hope is that it travels through space *and* time, first splashing against the rocks, but eventually breaking down the walls of cruelty and injustice. And if we do our best with the time we’re given, others will take hope in our example. https://t.co/RMJgrWQhP2"
2018-12-12 17:23:14,Barack Obama,1072904726180712453,"RT @ObamaFoundation: The Cares Family reaches across generational divides to reduce loneliness in the U.K. Hear more from Alex Smith, found…"
2018-12-10 15:40:51,Barack Obama,1072154184382844928,"No jump shots. No ferns. No memes. Not this time. I’m going to give it to you straight: If you need health insurance for 2019, the deadline to get covered is December 15. Go to https://t.co/ob1Ynoesod today and pass this on — you just might save a life. https://t.co/8mHMsXGY0g"
2018-12-08 14:17:50,Barack Obama,1071408513933602816,"RT @GetUSCovered: Just ONE WEEK LEFT to #GetCovered for 2019. Most folks can find coverage for $75 or less per month.

Head over to https:/…"
2018-12-02 22:09:40,Barack Obama,1069352929633755136,"Happy Hanukkah! Over these eight nights, we draw inspiration from light that can overpower any darkness, and recommit ourselves to building a brighter future for our families, our communities, and our world. Chag Sameach from the Obama family to yours."
2018-12-01 05:36:23,Barack Obama,1068740570921738241,"America has lost a patriot and humble servant in George Herbert Walker Bush. While our hearts are heavy today, they are also filled with gratitude. Our thoughts are with the entire Bush family tonight – and all who were inspired by George and Barbara’s example. https://t.co/g9OUPu2pjY"
2018-11-21 18:57:58,Barack Obama,1065318418470064128,"I am grateful for the next generation of leaders -- the young people who are tolerant, creative, idealistic and doing the work to create the world as it should be. Who understand that hope requires action. From the Obama family to yours, Happy Thanksgiving. https://t.co/AbjXUwCh6z"
2018-11-21 01:37:14,Barack Obama,1065056512324919296,"Thanks to the Chicago @FoodDepository team for all you do and to the volunteers who are doing great work and let me crash today. Happy Thanksgiving, everybody! https://t.co/r4QeBeCoT1"
2018-11-19 21:56:30,Barack Obama,1064638575139069953,RT @ObamaFoundation: The Obama Presidential Center represents a historic opportunity to build a world-class museum and public gathering spa…
2018-11-18 23:32:03,Barack Obama,1064300232308113408,"When someone shares their story, we see the world through their eyes. I’m looking forward to hearing a few from leaders around the world and sharing my own at the @ObamaFoundation Summit in Chicago. Tune in at https://t.co/GYkEOK8EuT. https://t.co/sOllDsDA1Z"
2018-11-15 16:43:52,Barack Obama,1063110344762105857,"Our future depends on all our young people, including our boys and young men of color, being able to achieve their dreams. Today, I’m proud to share @MBK_Alliance’s first investments in communities devoted to this mission. Get inspired: https://t.co/dKLWPvrFPC"
2018-11-13 18:37:35,Barack Obama,1062414184938377216,"Of course, @MichelleObama’s my wife, so I’m a little biased here. But she also happens to be brilliant, funny, wise – one of a kind. This book tells her quintessentially American story. I love it because it faithfully reflects the woman I have loved for so long. https://t.co/X0i9jja4TE"
2018-11-12 03:20:49,Barack Obama,1061821087724564480,"Michelle and I are heartbroken for everybody who’s lost so much in California, and grateful for the heroism of the firefighters who’ve been risking their lives around the clock to save others. Please do what you can to help our fellow Americans in need: https://t.co/13rm1D6Rwk"
2018-11-11 16:14:40,Barack Obama,1061653443058827264,"To all our veterans and your families: thank you. There's no tribute that can truly match the magnitude of your service and sacrifice. But all of us can do our best to live up to the American values of service, responsibility, generosity, and citizenship that you helped defend."
2018-11-07 16:13:21,Barack Obama,1060203563069198336,"Congratulations to everybody who showed up and participated in our democracy in record numbers yesterday. The change we need won’t come from one election alone – but it is a start. Last night, voters across the country started it. https://t.co/gNk4WkeJUn"
2018-11-06 16:26:40,Barack Obama,1059844527068979201,"Today is the day. Today, it’s your turn to raise your voice to change the course of this country for the better. So make it count. Get out there and vote. Go to https://t.co/NKXRGNgbZX or call 833-336-VOTE to confirm where you can vote and check voting hours. https://t.co/6xdMbKhwkr"
2018-11-05 18:46:31,Barack Obama,1059517330366087169,"If you take that power and vote, something powerful happens. Change happens. Hope happens. And with each new step we take in the direction of fairness, and justice, and equality, and opportunity, hope spreads. Go vote! https://t.co/NKXRGNgbZX"
2018-11-05 18:46:30,Barack Obama,1059517327815991299,"When you vote, you have the power to make it easier for a student to afford college, and harder for a disturbed person to shoot up a classroom. When you vote, you have the power to make sure a family keeps its health insurance."
2018-11-05 18:46:29,Barack Obama,1059517324053622785,"When you vote, you have the power to protect voting rights. To make sure our criminal justice system treats everyone equally under the law. To strengthen laws that protect women in the workplace from harassment – and make sure they’re paid equally."
2018-11-05 18:46:28,Barack Obama,1059517321524535296,"When we've been at such crossroads before, Americans have made the right choice. Not because we sat back and waited for history to happen -- but because we marched, and mobilized, and voted. We made history happen."
2018-11-05 18:46:27,Barack Obama,1059517317011398656,Tomorrow’s elections might be the most important of our lifetimes. The health care of millions is on the ballot. Making sure working families get a fair shake is on the ballot. The character of our country is on the ballot.
